company,Valuation ($B),Date Joined,country,city,industry,investors,valuation_b,date_joined,join_year,join_month,investor_count
Cato Networks,$2.50,11/17/2020,Israel,Tel Aviv,Cybersecurity,"Aspect Ventures, SingTel Innov8, Greylock Partners",2.5,2020-11-17,2020,11,3
Aura,$2.50,6/9/2021,United States,Burlington,Cybersecurity,"Warburg Pincus, General Catalyst",2.5,2021-06-09,2021,6,2
Vercel,$2.50,6/23/2021,United States,San Francisco,Internet software & services,"CRV, Accel, Google Ventures",2.5,2021-06-23,2021,6,3
Sysdig,$2.50,4/28/2021,United States,San Francisco,Cybersecurity,"Accel, Bain Capital Ventures, Insight Partners",2.5,2021-04-28,2021,4,3
Zetwerk,$2.68,8/20/2021,India,Bengaluru,Internet software & services,"Sequoia Capital India, Kae Capital, Accel",2.68,2021-08-20,2021,8,3
Uniphore,$2.50,2/16/2022,United States,Palo Alto,Artificial Intelligence,"Chiratae Ventures, March Capital Partners, National Grid Partners",2.5,2022-02-16,2022,2,3
Somatus,$2.50,2/23/2022,United States,McLean,Health,"The Blue Venture Fund, Flare Capital Partners, Longitude Capital",2.5,2022-02-23,2022,2,3
Immutable,$2.50,3/7/2022,Australia,Sydney,Fintech,"Fabric Ventures, AirTree Ventures, Temasek",2.5,2022-03-07,2022,3,3
A24 Films,$2.50,3/9/2022,United States,New York,Other,"Stripes Group, Neuberger Berman",2.5,2022-03-09,2022,3,2
SiFive,$2.50,3/16/2022,United States,San Mateo,Hardware,"Sutter Hill Ventures, Osage University Partners, Spark Capital",2.5,2022-03-16,2022,3,3
Games24x7,$2.50,3/30/2022,India,Mumbai,Internet software & services,"Tiger Global Management, The Raine Group, Malabar Investments",2.5,2022-03-30,2022,3,3
Fetch Rewards,$2.50,3/31/2021,United States,Madison,E-commerce & direct-to-consumer,"Greycroft, Loeb.NYC, DST Global",2.5,2021-03-31,2021,3,3
Coda Payments,$2.50,4/15/2022,Singapore,Fintech,"GIC. Apis Partners, Insight Partners",,2.5,2022-04-15,2022,4,0
DriveNets,$2.50,1/27/2021,Israel,Ra'anana,Internet software & services,"Bessemer Venture Partners, Pitango Venture Capital, D1 Capital Partners",2.5,2021-01-27,2021,1,3
Hibob,$2.45,10/12/2021,Israel,Tel Aviv,Internet software & services,"Bessemer Venture Partners, Eight Roads Ventures, Battery Ventures",2.45,2021-10-12,2021,10,3
Uala,$2.45,8/13/2021,Argentina,Buenos Aires,Fintech,"Soros Fund Management, Ribbit Capital, Monashees+",2.45,2021-08-13,2021,8,3
Mobile Premier League,$2.45,9/15/2021,India,Bengaluru,Internet software & services,"Sequoia Capital India, RTP Global, Go-Ventures",2.45,2021-09-15,2021,9,3
Cybereason,$2.44,8/6/2019,United States,Boston,Cybersecurity,"SoftBank Group, CRV, Spark Capital",2.44,2019-08-06,2019,8,3
Cgtz,$2.41,2/21/2017,China,Hangzhou,Fintech,"Shunwei Capital Partners, China Media Group, Guangzhou Huiyin Aofeng Equity Investment Fund",2.41,2017-02-21,2017,2,3
Star Charge,$2.41,5/19/2021,China,Changzhou,Auto & transportation,"Shunwei Capital Partners, China Media Group, Guangzhou Huiyin Aofeng Equity Investment Fund",2.41,2021-05-19,2021,5,3
EquipmentShare,$2.41,5/1/2020,United States,Columbia,Fintech,"Romulus Capital, Insight Partners, RedBird Capital Partners",2.41,2020-05-01,2020,5,3
Carbon,$2.40,8/20/2015,United States,Redwood City,Hardware,"Google Ventures, Sequoia Capital, Wakefield Group",2.4,2015-08-20,2015,8,3
PolicyBazaar,$2.40,5/6/2019,India,Gurgaon,Fintech,"Info Edge, Softbank Capital",2.4,2019-05-06,2019,5,2
Paxos,$2.40,4/29/2021,United States,New York,Fintech,"Liberty City Ventures, RRE Ventures, Mithril Capital Management",2.4,2021-04-29,2021,4,3
Exabeam,$2.40,6/1/2021,United States,Foster City,Cybersecurity,"Norwest Venture Partners, Aspect Ventures, Lightspeed Venture Partners",2.4,2021-06-01,2021,6,3
BitSight Technologies,$2.40,9/13/2021,United States,Boston,Cybersecurity,"Menlo Ventures, GGV Capital, Flybridge Capital Partners",2.4,2021-09-13,2021,9,3
Trumid,$2.40,7/15/2020,United States,New York,Fintech,"T. Rowe Price, Dragoneer Investment Group, BlackRock",2.4,2020-07-15,2020,7,3
ABL Space Systems,$2.40,3/25/2021,United States,El Segundo,Other,"T. Rowe Price, Lockheed Martin Ventures, Fidelity Investment",2.4,2021-03-25,2021,3,3
HoneyBook,$2.40,5/4/2021,United States,San Francisco,Internet software & services,"Norwest Venture Partners, Hillsven Capital, Aleph",2.4,2021-05-04,2021,5,3
Beta Technologies,$2.40,4/19/2022,United States,South Burlington,Other,"The Rise Fund, Fidelity Investments. RedBird Capital Partners",2.4,2022-04-19,2022,4,2
Project44,$2.62,6/1/2021,United States,Chicago,"Supply chain, logistics, & delivery","Emergence Capital Partners, 8VC, Chicago Ventures",2.62,2021-06-01,2021,6,3
Freenome,$2.62,8/26/2020,United States,South San Francisco,Health,"Andreessen Horowitz, Data Collective, Roche Venture Fund",2.62,2020-08-26,2020,8,3
ManyPets,$2.35,6/1/2021,United Kingdom,London,Fintech,"Octopus Ventures, Munich Re Ventures, CommerzVentures",2.35,2021-06-01,2021,6,3
Jobandtalent,$2.35,12/1/2021,Spain,Madrid,Internet software & services,"Kibo Ventures, SoftBank Group, Atomico",2.35,2021-12-01,2021,12,3
WEMAKEPRICE,$2.34,9/9/2015,South Korea,Seoul,E-commerce & direct-to-consumer,"IMM Investment, NXC",2.34,2015-09-09,2015,9,2
Biren Technology,$2.32,8/18/2020,China,Shanghai,Hardware,"V FUND, IDG Capital, Green Pine Capital Partners",2.32,2020-08-18,2020,8,3
Voodoo,$2.31,8/17/2020,France,Paris,Other,"Tencent Holdings, Goldman Sachs",2.31,2020-08-17,2020,8,2
Uptake,$2.30,10/27/2015,United States,Chicago,Artificial intelligence,"Revolution, New Enterprise Associates, Caterpillar",2.3,2015-10-27,2015,10,3
Motive,$2.85,4/23/2019,United States,San Francisco,"Supply chain, logistics, & delivery","Google Ventures, Index Ventures, Scale Venture Partners",2.85,2019-04-23,2019,4,3
Skydance Media,$2.30,2/11/2020,United States,Santa Monica,Other,"RedBird Capital Partners, CJ ENM, Tencent Holdings",2.3,2020-02-11,2020,2,3
Greenlight,$2.30,9/24/2020,United States,Atlanta,Fintech,"Relay Ventures, TTV Capital, Canapi Ventures",2.3,2020-09-24,2020,9,3
Bowery Farming,$2.30,5/25/2021,United States,New York,Other,"Temasek, Google Ventures, General Catalyst",2.3,2021-05-25,2021,5,3
Odoo,$2.30,7/29/2021,Belgium,Louvain-la-Neuve,Internet software & services,"Summit Partners, Noshaq, Sofinnova Partners",2.3,2021-07-29,2021,7,3
MoMo,$2.27,12/10/2021,Vietnam,Ho Chi Minh City,Fintech,"Goodwater Capital, Warburg Pincus, GS Growth",2.27,2021-12-10,2021,12,3
Zume,$2.25,11/1/2018,United States,Mountain View,Consumer & retail,"Softbank Group, AME Cloud Ventures, SignalFire",2.25,2018-11-01,2018,11,3
Algolia,$2.25,7/28/2021,United States,San Francisco,Internet software & services,"Accel, Alven Capital, Storm Ventures",2.25,2021-07-28,2021,7,3
Pattern,$2.25,10/6/2021,United States,Lehi,Internet software & services,"Knox Lane, Ainge Advisory, Carlson Private Capital Partners",2.25,2021-10-06,2021,10,3
Newfront Insurance,$2.20,4/12/2022,United States,San Francisco,Fintech,"Founders Fund, Meritech Capital Partners, GS Growth",2.2,2022-04-12,2022,4,3
NuCom Group,$2.20,2/22/2018,Germany,Unterfoehring,Other,General Atlantic,2.2,2018-02-22,2018,2,1
MUSINSA,$2.20,11/11/2019,South Korea,Seoul,E-commerce & direct-to-consumer,Sequoia Capital,2.2,2019-11-11,2019,11,1
Current,$2.20,4/27/2021,United States,New York,Fintech,"Expa, QED Investors, Foundation Capital",2.2,2021-04-27,2021,4,3
Bitso,$2.20,5/5/2021,Mexico,Mexico City,Fintech,"Pantera Capital, QED Investors, Coinbase Ventures",2.2,2021-05-05,2021,5,3
Gympass,$2.20,6/12/2019,United States,New York,Internet software & services,"General Atlantic, SoftBank Group, Atomico",2.2,2019-06-12,2019,6,3
Dialpad,$2.20,10/6/2020,United States,San Francisco,Internet software & services,"Andreessen Horowitz, Google Ventures, Section 32",2.2,2020-10-06,2020,10,3
G7 Networks,$2.20,2/15/2022,China,Beijing,"Supply chain, logistics, & delivery","Eastern Bell Capital 32, SDIC CMC Investment Management, Trustbridge Partners",2.2,2022-02-15,2022,2,3
BloomReach,$2.20,2/23/2022,United States,Mountain View,Artificial intelligence,"Bain Capital Ventures, Sixth Street Growth, Lightspeed Venture Partners",2.2,2022-02-23,2022,2,3
Motif FoodWorks,$2.20,6/16/2021,United States,Boston,Consumer & retail,"General Atlantic, Breakthrough Energy Ventures, Viking Global Investors",2.2,2021-06-16,2021,6,3
Huaqin Telecom Technology,$2.19,10/8/2019,China,Shanghai,Mobile & telecommunications,"Zhangjiang Haocheng Venture Capital, Walden International, Intel Capital",2.19,2019-10-08,2019,10,3
Accelerant,$2.19,1/12/2022,United Kingdom,Colchester,Other,"Deer Park Road, Altamont Capital Partners, Eldridge",2.19,2022-01-12,2022,1,3
Hesai Tech,$2.18,8/1/2020,China,Shanghai,Artificial intelligence,"Lightspeed China Partners, Baidu Ventures, Qiming Venture Partners",2.18,2020-08-01,2020,8,3
YITU Technology,$2.17,3/8/2018,China,Shanghai,Artificial intelligence,"Sequoia Capital China, Banyan Capital",2.17,2018-03-08,2018,3,2
Addepar,$2.17,6/15/2021,United States,Mountain View,Fintech,"8VC, D1 Capital Partners, Sway Ventures",2.17,2021-06-15,2021,6,3
Qualia,$2.17,12/21/2020,United States,San Francisco,Fintech,"8VC, Menlo Ventures, Tiger Global Management",2.17,2020-12-21,2020,12,3
Neo4j,$2,6/17/2021,United States,San Mateo,Data management & analytics,"Eight Roads Ventures, One Peak Partners, Creandum",2.0,2021-06-17,2021,6,3
CloudWalk,$2.15,9/8/2021,Brazil,Sao Paulo,Fintech,"Plug and Play Ventures, Valor Capital Group, DST Global",2.15,2021-09-08,2021,9,3
CoinDCX,$2.15,8/10/2021,India,Maharashtra,Fintech,"Polychain Capital, Coinbase Ventures, Jump Capital",2.15,2021-08-10,2021,8,3
FirstCry,$2.10,2/7/2020,India,Pune,E-commerce & direct-to-consumer,"SoftBank Group, SAIF Partners India, Valiant Capital Partners",2.1,2020-02-07,2020,2,3
Eightfold.ai,$2.10,10/27/2020,United States,Santa Clara,Internet software & services,"Foundation Capital, Institutional Venture Partners, General Catalyst",2.1,2020-10-27,2020,10,3
Urban Company,$2.10,4/27/2021,India,Gurgaon,E-commerce & direct-to-consumer,"VY Capital, Accel, Elevation Capital",2.1,2021-04-27,2021,4,3
ReCharge,$2.10,5/6/2021,United States,Los Angeles,Fintech,"ICONIQ Growth, Bain Capital Ventures, Summit Partners",2.1,2021-05-06,2021,5,3
Moveworks,$2.10,6/30/2021,United States,Mountain View,Artificial intelligence,"Lightspeed Venture Partners, Sapphire Ventures, Kleiner Perkins Caufield & Byers",2.1,2021-06-30,2021,6,3
Medable,$2.10,10/26/2021,United States,Palo Alto,Health,"GSR Ventures, Sapphire Ventures, Streamlined Ventures",2.1,2021-10-26,2021,10,3
GoCardless,$2.10,2/8/2022,United Kingdom,London,Fintech,"Accel, Passion Capital, Balderton Capital",2.1,2022-02-08,2022,2,3
Forto,$2.10,6/21/2021,Germany,Berlin,"Supply chain, logistics, & delivery","Cherry Ventures, Northzone Ventures, Global Founders Capital",2.1,2021-06-21,2021,6,3
Jeeves,$2.10,3/14/2022,United States,Orlando,Fintech,"Tencent Holdings, CRV, Clocktower Technology Ventures",2.1,2022-03-14,2022,3,3
Babel Finance,$2,5/25/2022,Hong Kong,Hong Kong,Fintech,"Dragonfly Capital, BAI Capital, 10T Fund",2.0,2022-05-25,2022,5,3
Trendy Group International,$2,2/13/2012,Hong Kong,Kowloon,Consumer & retail,L Capital Partners,2.0,2012-02-13,2012,2,1
Avant,$2,12/17/2012,United States,Chicago,Artificial intelligence,"RRE Ventures, Tiger Global, August Capital",2.0,2012-12-17,2012,12,3
Tubatu.com,$2,3/9/2015,China,Shenzhen,E-commerce & direct-to-consumer,"Sequoia Capital China, Matrix Partners China, 58.com",2.0,2015-03-09,2015,3,3
BlaBlaCar,$2,9/16/2015,France,Paris,Auto & transportation,"Accel Partners, Index Ventures, Insight Venture Partners",2.0,2015-09-16,2015,9,3
HuiMin,$2,9/5/2016,China,Beijing,E-commerce & direct-to-consumer,"Zheshang Venture Capital, GP Capital, Western Capital Management",2.0,2016-09-05,2016,9,3
Quora,$2,4/21/2017,United States,Mountain View,Internet software & services,"Y Combinator, Matrix Partners, Benchmark",2.0,2017-04-21,2017,4,3
Improbable,$1,5/11/2017,United Kingdom,London,Other,"Andreessen Horowitz, SoftBank Group, Temasek Holdings",1.0,2017-05-11,2017,5,3
Preferred Networks,$2,5/17/2018,Japan,Tokyo,Artificial intelligence,"Toyota Motor Corporation, Mizuho Financial Group, FANUC",2.0,2018-05-17,2018,5,3
Formlabs,$2,8/1/2018,United States,Somerville,Hardware,"Pitango Venture Capital, DFJ Growth Fund, Foundry Group",2.0,2018-08-01,2018,8,3
4Paradigm,$2,12/19/2018,China,Beijing,Artificial intelligence,"Sequoia Capital China, China Construction Bank, Bank of China",2.0,2018-12-19,2018,12,3
Calm,$2,2/6/2019,United States,San Francisco,Internet software & services,"Insight Venture Partners, TPG Growth, Sound Ventures",2.0,2019-02-06,2019,2,3
Kaseya,$2,3/27/2019,United States,Miami,Cybersecurity,"Insight Partners, TPG Alternative & Renewable Technologies, Ireland Strategic Investment Fund",2.0,2019-03-27,2019,3,3
Mafengwo,$2,5/23/2019,China,Beijing,Travel,"Qiming Venture Partners, Capital Today, General Atlantic",2.0,2019-05-23,2019,5,3
Druva,$2,6/20/2019,United States,Sunnyvale,Data management & analytics,"Nexus Venture Partners, Tenaya Capital, Sequoia Capital",2.0,2019-06-20,2019,6,3
Kujiale,$2,10/25/2019,China,Hangzhou,Internet software & services,"GGV Capital, IDG Capital, Linear Venture",2.0,2019-10-25,2019,10,3
AppsFlyer,$2,1/21/2020,United States,San Francisco,Mobile & telecommunications,"Magma Venture Partners, Pitango Venture Capital, Qumra Capital",2.0,2020-01-21,2020,1,3
Keep,$2,5/19/2020,China,Beijing,Internet software & services,"Bertelsmann Asia Investments, GGV Capital, Morningside Venture Capital",2.0,2020-05-19,2020,5,3
Redis Labs,$2,8/25/2020,United States,Mountain View,Data management & analytics,"Viola Ventures, Dell Technologies Capital, Bain Capital Ventures",2.0,2020-08-25,2020,8,3
Xingyun Group,$2,9/24/2020,China,Shenzhen,E-commerce & direct-to-consumer,"Matrix Partners China, Eastern Bell Capital, Hongtai Capital Holdings",2.0,2020-09-24,2020,9,3
Unqork,$2,10/6/2020,United States,New York,Fintech,"Blackrock, capitalG, World Lab Innovation",2.0,2020-10-06,2020,10,3
Virta Health,$2,12/2/2020,United States,San Francisco,Health,"Caffeinated Capital, Obvious Ventures, Venrock",2.0,2020-12-02,2020,12,3
ISN,$2,12/17/2020,United States,Dallas,"Supply chain, logistics, & delivery",Blackstone,2.0,2020-12-17,2020,12,1
Earnix,$2,2/21/2021,Israel,Giv'atayim,Fintech,"Jerusalem Venture Partners, Israel Growth Partners, Insight Partners",2.0,2021-02-21,2021,2,3
Guoquan Shihui,$2,3/17/2021,China,Shanghai,Consumer & retail,"Tiantu Capital, CMB International Capital, Vision Knight Capital",2.0,2021-03-17,2021,3,3
Clearco,$2,4/20/2021,Canada,Toronto,Fintech,"Highland Capital Partners, Oak HC/FT Partners, Emergence Capital Partners",2.0,2021-04-20,2021,4,3
Hive,$2,4/21/2021,United States,San Francisco,Artificial intelligence,"Tomales Bay Capital, Bain & Company, General Catalyst",2.0,2021-04-21,2021,4,3
KRY,$2,4/27/2021,Sweden,Stockholm,Health,"Index Ventures, Creandum, Accel",2.0,2021-04-27,2021,4,3
Kajabi,$2,5/4/2021,United States,Irvine,Internet software & services,"Meritech Capital Partners, Tiger Global Management, Spectrum Equity",2.0,2021-05-04,2021,5,3
Ethos,$2.70,5/11/2021,United States,San Francisco,Fintech,"Sequoia Capital, Google Ventures, Accel",2.7,2021-05-11,2021,5,3
PayFit,$2.10,1/6/2022,United Kingdom,London,Fintech,"Accel, frst, Kima Ventures",2.1,2022-01-06,2022,1,3
Beisen,$2,5/11/2021,China,Beijing,Internet software & services,"Matrix Partners China, Sequoia Capital China, Genesis Capital",2.0,2021-05-11,2021,5,3
Pipe,$2,5/19/2021,United States,Miami,Fintech,"next47, MaC Venture Capital, FinVC",2.0,2021-05-19,2021,5,3
Iterable,$2,6/15/2021,United States,San Francisco,Internet software & services,"CRV, Blue Cloud Ventures, Index Ventures",2.0,2021-06-15,2021,6,3
Bunq,$2,6/18/2021,Netherlands,Amsterdam,Fintech,Undisclosed,2.0,2021-06-18,2021,6,1
Clip,$2,6/10/2021,Mexico,Mexico City,Fintech,"Alta Ventures Mexico, General Atlantic, SoftBank Group",2.0,2021-06-10,2021,6,3
Loggi,$2,6/5/2019,Brazil,Sao Paulo,"Supply chain, logistics, & delivery","Qualcomm Ventures, SoftBank Group. Monashees+",2.0,2019-06-05,2019,6,2
MURAL,$2,7/20/2021,United States,San Francisco,Internet software & services,"Insight Partners, Tiger Global Management, Gradient Ventures",2.0,2021-07-20,2021,7,3
OCSiAl,$2,3/4/2019,Luxembourg,Leudelange,Other,"A&NN, Rusnano",2.0,2019-03-04,2019,3,2
XtalPi,$2,8/11/2021,China,Shenzhen,Artificial intelligence,"Tencent Holdings, 5Y Capital, Sequoia Capital China",2.0,2021-08-11,2021,8,3
Divvy Homes,$2,8/13/2021,United States,San Francisco,Fintech,"Andreessen Horowitz, Caffeinated Capital, SciFi VC",2.0,2021-08-13,2021,8,3
Apeel Sciences,$2,5/26/2020,United States,Goleta,Other,"Upfront Ventures, Tao Capital Partners, Andreessen Horowitz",2.0,2020-05-26,2020,5,3
Opay,$2,8/23/2021,Nigeria,Lagos,Fintech,"Sequoia Capital China, Source Code Capital, Redpoint Ventures China",2.0,2021-08-23,2021,8,3
Aviatrix,$2,9/8/2021,United States,Santa Clara,Internet software & services,"Ignition Partners, Formation 8, CRV",2.0,2021-09-08,2021,9,3
SmartNews,$2,8/5/2019,Japan,Tokyo,Mobile & telecommunications,"Japan Post Capital, Globis Capital Partners, Atomico",2.0,2019-08-05,2019,8,3
Misfits Market,$2,4/21/2021,United States,Pennsauken,"Supply chain, logistics, & delivery","Accel, D1 Capita Partners, Greenoaks Capital Management",2.0,2021-04-21,2021,4,3
Spring Health,$2,9/16/2021,United States,New York,Health,"Rethink Impact, Work-Bench, RRE Ventures",2.0,2021-09-16,2021,9,3
Black Sesame Technologies,$2,9/22/2021,China,Shanghai,Artificial intelligence,"Northern Light Venture Capital, Xiaomi, FutureX Capital",2.0,2021-09-22,2021,9,3
Advance Intelligence Group,$2,9/23/2021,Singapore,Artificial intelligence,"Vision Plus Capital, GSR Ventures, ZhenFund",,2.0,2021-09-23,2021,9,0
Modern Treasury,$2,10/6/2021,United States,San Francisco,Fintech,"Benchmark, Altimeter Capital, Quiet Capital",2.0,2021-10-06,2021,10,3
Magic Leap,$2,10/21/2014,United States,Plantation,Hardware,"Obvious Ventures, Qualcomm Ventures, Andreessen Horowitz",2.0,2014-10-21,2014,10,3
Tier,$2,10/25/2021,Germany,Berlin,Travel,"Northzone Ventures, White Star Capital, Novator Partners",2.0,2021-10-25,2021,10,3
ClickHouse,$2,10/28/2021,United States,Portola Valley,Data management & analytics,"Lightspeed Venture Partners, Almaz Capital Partners, Altimeter Capital",2.0,2021-10-28,2021,10,3
Mynt,$2,11/1/2021,Philippines,Taguig City,Fintech,"Insight Partners, Warburg Pincus, Ayala Corporation",2.0,2021-11-01,2021,11,3
Everlaw,$2,3/10/2020,United States,Oakland,Internet software & services,"K9 Ventures, Menlo Ventures, Andreessen Horowitz",2.0,2020-03-10,2020,3,3
Zilch,$2,11/10/2021,United Kingdom,London,Fintech,"Gauss Ventures, Ventura Capital, dmg ventures",2.0,2021-11-10,2021,11,3
VerbIT,$2,6/8/2021,United States,New York,Artificial intelligence,"ClalTech, Vertex Ventures, Oryzn Capital",2.0,2021-06-08,2021,6,3
StarkWare,$8,11/17/2021,Israel,Netanya,Cybersecurity,"Sequoia Capital, Paradigm, Pantera Capital",8.0,2021-11-17,2021,11,3
Netlify,$2,11/17/2021,United States,San Francisco,Internet software & services,"Andreessen Horowitz, Kleiner Perkins Caufield & Byers, EQT Ventures",2.0,2021-11-17,2021,11,3
SWORD Health,$2,11/22/2021,United States,New York,Health,"Khosla Ventures, Green Innovations, Founders Fund",2.0,2021-11-22,2021,11,3
LTK,$2,11/22/2021,United States,Dallas,Internet software & services,"SoftBank Group, Maverick Capital",2.0,2021-11-22,2021,11,2
Trax,$2,7/22/2019,Singapore,Artificial intelligence,"Hopu Investment Management, Boyu Capital, DC Thomson Ventures",,2.0,2019-07-22,2019,7,0
Exotec,$2,1/17/2022,France,Croix,Hardware,"Breega Capital, Iris Capital, 360 Capital Partners",2.0,2022-01-17,2022,1,3
Dremio,$2,1/6/2021,United States,Santa Clara,Data management & analytics,"Lightspeed Venture Partners, Redpoint Ventures, Norwest Venture Partners",2.0,2021-01-06,2021,1,3
Akulaku,$2,2/15/2022,Indonesia,Jakarta,E-commerce & direct-to-consumer,"DCM Ventures, IDG Capital, Siam Commercial Bank",2.0,2022-02-15,2022,2,3
Cloudinary,$2,2/15/2022,United States,Santa Clara,Internet software & services,"Blackstone, Bessemer Venture Partners",2.0,2022-02-15,2022,2,2
Lunar,$2,7/12/2021,Denmark,Aarhus,Fintech,"SEED Capital, Greyhound Capital, Socii Capital",2.0,2021-07-12,2021,7,3
UpGrad,$2.25,8/9/2021,India,Mumbai,Edtech,"Qualcomm Ventures, Accel, Canaan Partners",2.25,2021-08-09,2021,8,3
Salsify,$2,4/13/2022,United States,Boston,Internet software & services,"Matrix Partners, North Bridge Venture Partners, Venrock",2.0,2022-04-13,2022,4,3
CertiK,$2,3/31/2022,United States,New York,Cybersecurity,"Tiger Global Management, Lightspeed Venture Partners, Hillhouse Capital Management",2.0,2022-03-31,2022,3,3
ROX Motor,$2,4/29/2022,China,Shanghai,Auto & transportation,"Sequoia Capital China, IDG Capital, Qiming Venture Partners",2.0,2022-04-29,2022,4,3
Hugging Face,$2,5/9/2022,United States,New York,Artificial intelligence,"Betaworks Ventures, Addition, Lux Capital",2.0,2022-05-09,2022,5,3
Devo Technology,$2,10/26/2021,United States,Cambridge,Data management & analytics,"Insight Partners, Kibo Ventures, Bessemer Venture Partners",2.0,2021-10-26,2021,10,3
Rimac Automobili,$2,6/1/2022,Croatia,Sveta Nedelja,Auto & transportation,"Porsche, 	InvestIndustrial, SoftBank Group",2.0,2022-06-01,2022,6,3
Geek+,$2,11/21/2018,China,Beijing,Hardware,"Volcanics Ventures, Vertex Ventures China, Warburg Pincus",2.0,2018-11-21,2018,11,3
ZigBang,$1.93,6/7/2022,South Korea,Seoul,Mobile & telecommunications,"Black Pearl Ventures, Stonebridge Ventures, Yuanta Investment Korea",1.93,2022-06-07,2022,6,3
Ankorstore,$1.98,1/10/2022,France,Paris,E-commerce & direct-to-consumer,"Global Founders Capital, Aglae Ventures, Alven Capital",1.98,2022-01-10,2022,1,3
Fenbi Education,$1.95,2/7/2021,China,Beijing,Edtech,"Trustbridge Partners, Hony Capital, IDG Capital",1.95,2021-02-07,2021,2,3
Rokt,$1.95,12/16/2021,United States,New York,Internet software & services,"Square Peg Capital, TDM Growth Partners, Tiger Global Management",1.95,2021-12-16,2021,12,3
InVision,$1.90,11/1/2017,United States,New York,Internet software & services,"FirstMark Capital, Tiger Global Management, ICONIQ Capital",1.9,2017-11-01,2017,11,3
eDaili,$1.90,2/1/2019,China,Shanghai,E-commerce & direct-to-consumer,"K2VC, Lightspeed China Partners, Sky9 Capital",1.9,2019-02-01,2019,2,3
MX Technologies,$1.90,1/13/2021,United States,Lehi,Fintech,"Point72 Ventures, Pelion Venture Partners, Commerce Ventures",1.9,2021-01-13,2021,1,3
Aledade,$1.90,1/19/2021,United States,Bethesda,Health,"Venrock, CVF Capital Partners, ARCH Venture Partners",1.9,2021-01-19,2021,1,3
CoinSwitch Kuber,$1.90,10/6/2021,India,Bangalore,Fintech,"Tiger Global Management, Sequoia Capital India, Ribbit Capital",1.9,2021-10-06,2021,10,3
Acorns,$1.90,3/9/2022,United States,Irvine,Fintech,"e.ventures, Bain Capital Ventures, Greycroft",1.9,2022-03-09,2022,3,3
Roofstock,$1.94,3/10/2022,United States,Oakland,Fintech,"Khosla Ventures, Bain Capital Ventures, Lightspeed Venture Partners",1.94,2022-03-10,2022,3,3
thatgamecompany,$1.94,3/3/2022,United States,Los Angeles,Internet software & services,"Benchmark, Sequoia Capital, TPG Capital",1.94,2022-03-03,2022,3,3
ConcertAI,$1.90,3/29/2022,United States,Boston,Artificial Intelligence,"Sixth Street Partners, Declaration Partners, Maverick Ventures Israel",1.9,2022-03-29,2022,3,3
Material Bank,$1.90,5/6/2022,United States,Boca Raton,E-commerce & direct-to-consumer,"Bain Capital Ventures, SoftBank Group, Fifth Wall Ventures",1.9,2022-05-06,2022,5,3
Volocopter,$1.87,3/4/2022,Germany,Bruchsal,Auto & transportation,"btov Partners, Geely, Intel Capital",1.87,2022-03-04,2022,3,3
ENOVATE,$1.85,4/15/2019,China,Shanghai,Auto & transportation,Automobile Industry Guidance Fund,1.85,2019-04-15,2019,4,1
MEGAZONE,$1.83,8/16/2022,South Korea,Seoul,Internet,"Salesforce Ventures, ATP Investment, kt investment",1.83,2022-08-16,2022,8,3
CFGI,$1.85,9/15/2021,United States,Boston,Fintech,"The Carlyle Group, CVC Capital Partners",1.85,2021-09-15,2021,9,2
ZocDoc,$1.80,8/20/2015,United States,New York,Health,"Founders Fund, Khosla Ventures, Goldman Sachs",1.8,2015-08-20,2015,8,3
Diamond Foundry,$1.80,3/29/2021,United States,San Francisco,Other,"Fashion Tech Lab, Fidelity Investments, Vast Ventures",1.8,2021-03-29,2021,3,3
FullStory,$1.80,8/4/2021,United States,Atlanta,Internet software & services,"Google Ventures, Kleiner Perkins Caufield & Byers, Stripes Group",1.8,2021-08-04,2021,8,3
Lightricks,$1.80,7/31/2019,Israel,Jerusalem,Artificial intelligence,"Viola Ventures, Insight Partners, ClalTech, Goldman Sachs",1.8,2019-07-31,2019,7,4
Opentrons,$1.80,9/23/2021,United States,New York,Hardware,"SOSV, Khosla Ventures, Lerer Hippeau",1.8,2021-09-23,2021,9,3
Slice,$1.80,11/28/2021,India,Bengaluru,Fintech,"Gunosy Capital, Blume Ventures, Das Capital",1.8,2021-11-28,2021,11,3
Cambrian BioPharma,$1.79,10/26/2021,United States,Brooklyn,Health,"Future Ventures, Apeiron Investment Group, Moore Capital Management",1.79,2021-10-26,2021,10,3
AIWAYS,$1.78,4/16/2018,China,Shanghai,Auto & transportation,"Jiangsu Sha Steel Group, Shanghai Puyin Industry, Funa Yuanchuang Technology",1.78,2018-04-16,2018,4,3
Trulioo,$1.75,6/7/2021,Canada,Vancouver,Cybersecurity,"Blumberg Capital, American Express Ventures, BDC Venture Capital",1.75,2021-06-07,2021,6,3
Spinny,$1.75,11/24/2021,India,Gurugram,E-commerce & direct-to-consumer,"General Catalyst, Eleation Capital, Avenir Growth Capital",1.75,2021-11-24,2021,11,3
Crusoe,$1.75,4/21/2022,United States,Denver,Internet software & services,"Bain Capital Ventures, Founders Fund, Winklevoss Capital",1.75,2022-04-21,2022,4,3
Orca Security,$1.80,3/23/2021,United States,Portland,Cybersecurity,"YL Ventures, Redpoint Ventures, GGV Capital",1.8,2021-03-23,2021,3,3
Apus Group,$1.73,1/16/2015,China,Beijing,Mobile & telecommunications,"Redpoint Ventures, QiMing Venture Partners, Chengwei Capital",1.73,2015-01-16,2015,1,3
